reviewID,employerID,userID,gender,birthYear,highestEducation,metroID,metroName,stateID,stateName,countryID,jobTitleID,JobTitle,GOC,GOCconfidence,MGOC,MGOCconfidence,reviewDateTime,isCurrentJobFlag,jobEndingYear,OverallRating,CareerOpps,CompensationBenefits,SeniorLeadership,Worklife,CultureValues,RecommendFriend,BusinessOutlook,CEO,employerName,stockTicker,employerTypeCode,numberEmployees,annualRevenue,industry,sector,pros,cons,feedback
12327961,11891,46488531,,,,0,,0,,1,0,,,,,,2016-10-16 01:46:51.697,1,,1.0,1.0,1.0,1.0,4.0,1.0,NO,Worse,No Opinion,Netflix,NFLX,COMPANY_PUBLIC,4700,8830669000,Internet,Information Technology,Free Starbucks and snacks. Free Netflix,"Everyone starts at the same hourly pay even if you have experience. The management says they are big on feedback but they will use it against you. Netflix manages on a ""do as I say not as I do"" philosophy. Managers are the only ones allowed cell phones and pens, employees are not. Training doesn't prepare you for the actual job. I was a Netflix customer from day one which is why I wanted to work for them and after being an employee I wouldn't recommend them as a employer or as a customer. Will leave as soon as another job is secured.",Pre screen employees better so you can treat the employees like adults rather than toddlers who can't be trusted. Stop hiring TSR's based on seniority but on skill.
12374026,11891,49054228,FEMALE,,,761,San Jose,2280,CA,1,0,,,,,,2016-10-19 11:09:33.85,0,2016.0,4.0,1.0,5.0,5.0,4.0,5.0,YES,Better,,Netflix,NFLX,COMPANY_PUBLIC,4700,8830669000,Internet,Information Technology,"Benefits and perks are amazing.. office food&snacks, unlimited vacation, one year maternity leave, amazing leadership by Reed.","No mentorship, no at the job training. Hard to get promotion because they will simply go out and hire someone instead of internally developing people",
12404232,11891,47394058,,,,0,,0,,1,0,,,,,,2016-10-21 12:49:13.837,0,2013.0,5.0,5.0,5.0,4.0,3.0,5.0,YES,Better,Approve,Netflix,NFLX,COMPANY_PUBLIC,4700,8830669000,Internet,Information Technology,"Great people and great culture. Check out the Netflix Culture Deck at www.slideshare.net/reed2001/culture-1798664. They practice what they preach with ""Context, not control"", ""Freedom and responsibility"", and hiring fast/firing fast.","For folks looking for a ""safe"" company with which to work, Netflix is not your place (nor does it want to be). Benefits are great (including a lucrative stock purchase plan), but like pro-athletes, you can't think of Netflix as a cradle-to-grave company.",Keep taking risks and keep hiring the best!
12485584,11891,49477699,FEMALE,,,508,Los Angeles,2280,CA,1,3071724,Content Distribution Coordinator,coordinator,0.5211918950080872,program coordinator,0.5211918950080872,2016-10-28 12:06:32.42,1,,5.0,5.0,5.0,4.0,4.0,5.0,YES,Better,No Opinion,Netflix,NFLX,COMPANY_PUBLIC,4700,8830669000,Internet,Information Technology,The company culture makes every day a superior work experience. I have stellar colleagues and interesting challenges every day. I look forward to coming to work every day.,"High performance is expected at all times which is not challenging by itself, but it can wear you down if you don't handle stress well.",
12564313,11891,35711094,FEMALE,,,508,Los Angeles,2280,CA,1,374710,Senior Web UI Engineer,ui engineer,0.9110000133514404,front end engineer,0.9110000133514404,2016-11-04 16:14:38.033,1,,3.0,3.0,2.0,3.0,1.0,4.0,NO,Better,Approve,Netflix,NFLX,COMPANY_PUBLIC,4700,8830669000,Internet,Information Technology,share knowledge with smart people from the world.,Sometimes exhausting long works at company,
12664744,11891,2298577,FEMALE,,,0,,0,,1,0,,,,,,2016-11-14 11:59:52.26,1,,5.0,5.0,5.0,5.0,5.0,5.0,YES,Better,Approve,Netflix,NFLX,COMPANY_PUBLIC,4700,8830669000,Internet,Information Technology,The best company I've ever worked at. Read the culture deck - every word of it is true and actively practiced.,None. Workload can be a bit intense at times but that's to be expected.,"As we expand internationally, make sure that we maintain our culture and values"
12685871,11891,49475049,MALE,,,0,,0,,1,0,,,,,,2016-11-15 21:22:29.88,0,2016.0,2.0,3.0,5.0,1.0,2.0,1.0,NO,Worse,Disapprove,Netflix,NFLX,COMPANY_PUBLIC,4700,8830669000,Internet,Information Technology,An offer you cant resist,"You will literally quit a decent job to come here thinking you have found something great only to find that you have stepped in front of an immature high school firing squad. There is no obectivity to the termination process so any of them could terminate for unethical reasons that are summed up in the phrase, you are not a high performer or you weren't a right fit. There constantly breathing down your neck and watching you looking for you to do something wrong. THeres little warning. Generally you get one. If your lucky or buddy buddy with with management or the supes you might get a bit more slack, maybe a lot more. If they dont like what they see they could be rid of you in less than a month and they openly joke about terminating people and about how expendable you are from day one. I read the reviews on here and went in and smellled the fish immediately. FIrst off they bring on a ton of people all the time for an amazing job so where do they end up. All of this is contingent on whether they decide if you are fit for production. You could be let go at the end of training and they dont give you any metrics on how that decision is made.",Remember that you are giving skilled people an amazing offer that leads many to leave stable employment. By making impossibly high expectations with no metrics applied to the termination process the vast majority wont hit the mark and office politics will govern the termination process. Luring people into a firing pit hurts them and there families and puts a dent in there career. Remember that. Your hurting people.
12700169,11891,39043202,FEMALE,1992.0,HIGH_SCHOOL,0,,0,,1,126998,CSR-1,inventory specialist,0.912999987602234,inventory specialist,0.912999987602234,2016-11-16 21:40:17.613,0,2016.0,3.0,1.0,5.0,3.0,3.0,3.0,YES,Same,Approve,Netflix,NFLX,COMPANY_PUBLIC,4700,8830669000,Internet,Information Technology,"Pay was great, flexible schedule to meet your needs, scheduling extra hours, attendance bonuses, great benefits including 401k match and vacation.","Dealing with non tech savvy customers, contradicting management styles, the location, no room to grow.",
12850759,11891,1132654,,,,761,San Jose,2280,CA,1,160524,Senior Data Engineer,data engineer,1.0,database engineer,1.0,2016-12-01 10:12:45.627,1,,5.0,5.0,5.0,5.0,5.0,5.0,YES,Better,Approve,Netflix,NFLX,COMPANY_PUBLIC,4700,8830669000,Internet,Information Technology,"Rockstar coworkers, no brilliant jerks
excellent pay, no vacation policy or tracking
fast paced environment, minimal distractions and no unnecessary process - get loads of work done everyday.
I can tell my friends I work in showbiz :)","None that I can think of, really. I guess the culture might take a bit adjusting to if you are not used to it.",
12861435,11891,47452097,MALE,,,761,San Jose,2280,CA,1,17979,Senior Software Engineer In Test,software engineer in test,1.0,software engineer,1.0,2016-12-02 07:35:25.777,1,,3.0,2.0,4.0,2.0,4.0,3.0,NO,Same,Approve,Netflix,NFLX,COMPANY_PUBLIC,4700,8830669000,Internet,Information Technology,"High-performing culture
Unlimited vacation
Pick your time to work
Great pay","High performing culture
If you get a manager that micro-manages it becomes annoying
Too date driven while sacrificing quality - for a QA professional that's hard to take",
13039982,11891,2073945,FEMALE,,,755,Salt Lake City,255,UT,1,60210,Customer Service Representative,customer service representative,1.0,customer service,1.0,2016-12-18 12:43:48.173,0,2016.0,2.0,1.0,4.0,1.0,1.0,1.0,NO,Worse,No Opinion,Netflix,NFLX,COMPANY_PUBLIC,4700,8830669000,Internet,Information Technology,"Free snacks, good benefits, nice coworkers","Everything depends on your Supervisor, if you get the wrong one they will be condescending, demean you, micromanage you and fire you for no logical reason. No explanation, no exit interview, nothing in writing. I had the most unprofessional Supervisor I have ever met.",Please research why a person was fired. Don't trust your call center Management. They will fire reps for nothing. This could cause possible lawsuits in the future.
13071088,11891,43614415,FEMALE,,,0,,0,,1,0,,,,,,2016-12-21 09:42:19.067,0,2015.0,3.0,3.0,4.0,2.0,2.0,2.0,NO,Better,Approve,Netflix,NFLX,COMPANY_PUBLIC,4700,8830669000,Internet,Information Technology,"Get to work on a lot off different aspects, transparency, work with smart people, Reed Hastings","People pick and choose from cultural deck, varies from team to team, supervisor felt entitled based on tenure, not a good leader, complete opposite of the traits from the deck","Recognize weak management early, review tenured employees as well"
13239473,11891,15854049,MALE,1959.0,BACHELORS,234,Denver,2519,CO,1,0,,,,,,2017-01-08 20:22:27.117,0,2013.0,1.0,2.0,4.0,1.0,1.0,1.0,NO,Worse,No Opinion,Netflix,NFLX,COMPANY_PUBLIC,4700,8830669000,Internet,Information Technology,Good pay for the work,"Awful place to work, they work you 12 hours a day with terrible hours then let you go after 9 years with no cause.",
13285303,11891,41377371,FEMALE,1995.0,BACHELORS,0,,0,,1,0,,,,,,2017-01-11 14:55:50.29,0,2016.0,1.0,5.0,5.0,1.0,3.0,1.0,NO,,,Netflix,NFLX,COMPANY_PUBLIC,4700,8830669000,Internet,Information Technology,"Good work, good pay. Energetic environment. New technologies.","Experience in Netflix totally depends on the supervisor. If you are lucky and get a matured manager, there is no reason to not like working in NETFLIX.  However it could be a nightmare if your manager does not like you for some reason. It is always your words vs manager's word in there (happened in my case and they believe the manager). I was hired under a manager who convinced me to join Netflix (I had 24 emails from that person persuading me). However I learned after joining that I am supposed to report to a new manager and the very first day that new guy complained that I have never worked with JAVA and AWS (Then why did he agree to take me in his team in the first place ? ). Nightmare started from that very day.  He kept on mentioning the same thing every one on one. He forced me to move my position in every meeting and make sure I seat where he points me to. He will talk to all my co-workers and inform them if he is cancelling one on ones, for me he wont do anything and just disappear. He 
will constantly irritate me saying how good he was when he joined. He will always shout at me and try to ignore my opinions on any damn technical stuff. I was totally terrified of him and knew that he will make sure that I fail. He tried all he could.   He gave me two projects and one project scope kept changing and changing. Still i tried to keep up and developed good relationships with other team managers, members and project managers.One day (I am sure my manager was waiting for that day) I wrote something incorrect in an email (this is my 4th month I guess). He pounded on me, and also after a 14 hour continuous on call, I took a 2 min break, he shouted at me for 15 minutes for missing a false alram ! I apologized. He tried to blame me for what I did not do and said he and someone else was watching me silently, while I was chatting with someone else about some technical issue over a group chat. So unethical !  He said some PM complained about me and when I asked for the names and examples he refused. I raised the alarm to higher management and they said it is ""his word vs mine"". One day they said they are sorry I had to go through this and next day they change the tone and said they have to believe my manager. I requested them to talk to engineers and get feedback. They refused to even do that.  I resigned the next week as I could not take the humiliation and realized that if I stay back and work in the same group, they will find some excuse to fire me. I knew all companies where I worked before were waiting to take me back any day. So I had no worry.  The funny part is the people who were working with me kept on sending me emails about how good it was to work with me and they were surprised that I left. But my manager never found anything good in me. 

I wish I had a better manager in NETFLIX, then I would enjoy my life there so much. Please make sure you understand your supervisor before you join. That is the most important thing. Everything else will fall into place.","Give engineers some more respect and try to understand who is at fault. Look at that persons history before you conclude in 4 months or 5th months just based on one person, the manager who was not happy with the hire from very very first day."
13304614,11891,17568189,FEMALE,1981.0,BACHELORS,761,San Jose,2280,CA,1,23804,Anonymous,,0.0,,0.0,2017-01-12 19:46:36.537,1,,4.0,3.0,5.0,3.0,4.0,3.0,YES,Better,Approve,Netflix,NFLX,COMPANY_PUBLIC,4700,8830669000,Internet,Information Technology,"High Salary
Great co-workers
Beautiful South Bay location 
Relatively ""small"" company
Free hot lunch, stocked kitchen
Lots of SWAG
Great PTO policy","Lack of internal growth opportunities 
Stock ""options"" not ""shares""
High turnover - can be cut throat
Lack of diversity 
No recognized holidays.
Double standards for executive staff.",Reevaluate prioritites and distribute the wealth more evenly.
13565149,11891,50947233,MALE,,,700,Portland,3163,OR,1,60210,Customer Service Representative,customer service representative,1.0,customer service,1.0,2017-01-31 09:52:18.927,0,2013.0,3.0,3.0,2.0,2.0,2.0,3.0,YES,Better,Approve,Netflix,NFLX,COMPANY_PUBLIC,4700,8830669000,Internet,Information Technology,Free Movies and great environment.,your truly were better off staying average.  If you were good you got promoted then fired.  If you were bad you just got fired,Find incentives for people to excel!
13573508,11891,41286821,,,,761,San Jose,2280,CA,1,1107357,Data Engineering Manager,data engineer,0.9110000133514404,database engineer,0.9110000133514404,2017-01-31 18:13:14.87,0,2015.0,4.0,4.0,5.0,5.0,4.0,5.0,YES,Better,Approve,Netflix,NFLX,COMPANY_PUBLIC,4700,8830669000,Internet,Information Technology,"Great culture, great company, nice technology stack",Can not think of any cons,Keep at it.
13695485,11891,21845096,FEMALE,1971.0,MASTERS,761,San Jose,2280,CA,1,17676,Senior Project Manager,project manager,1.0,project manager,1.0,2017-02-08 13:58:09.573,1,,2.0,1.0,3.0,3.0,2.0,2.0,NO,Better,No Opinion,Netflix,NFLX,COMPANY_PUBLIC,4700,8830669000,Internet,Information Technology,"Free food, fun projects, shuttles to many places in the Bay Area. If you're full-time the culture makes it easy to make your little slice of work your own.","They treat contractors like crap. Well at least this is the case in the department I was in. You are hamstrung by being a contractor and not having access to all information, not even knowing that you need access to this information or not even realizing you are missing information until it's too late. That might not be a problem for all contract positions, but as a project manager, it's essential that we are least made of aware of any news that might possibly affect the components we are in charge of.

The diversity is tragic. It's not as bad as many other Bay Area tech companies, but there is a lot of instances where one sibling gets another one in, one spouse will get another one in, friends from previous employment hire each other to recreate whatever made them leave the original company,  etc.

I worked in a department with mainly an international team and when I started there were several comments made by my coworkers about how, because of my nationality, I therefore couldn't possibly understand certain issues like internationalization. I found several of the people to be very condescending if you didn't come from X school or worked at Y company.

The lack of feedback from your manager is non-existent. Again this might just be a contractor thing but for me I found that the majority of my coworkers were happy with my work, my stakeholders were happy with my work, I'd received kudos from my manager, etc. Then when a full-time position came available I applied and was essentially told by my manager that I wasn't good enough. I won't argue that decision because it's subjective but isn't it the Netflix policy that if a manager isn't happy with their employee it's best to just let them go and then find the best fit? After all, if I'm not good enough to be at Netflix then why are still keeping me around? I can only speculate as to the reasons so it's not even worth me writing them here.

Also in general, I know very few contractors since the time I've been here who have been converted to full-time. Some have been here as long as 2 years or longer.","Don't say you are committed to diversity if you really aren't paying attention to the hiring practices of the B and C level managers who are all too often just hiring their buddies.

Netflix is scaling rapidly with new people and new products. My suggestion would be to find a way to facilitate interdepartmental learnings, this way you don't run the risk of people duplicating efforts."
13736439,11891,53124693,FEMALE,1992.0,BACHELORS,755,Salt Lake City,255,UT,1,126998,CSR-1,inventory specialist,0.912999987602234,inventory specialist,0.912999987602234,2017-02-11 07:51:34.013,1,,4.0,3.0,5.0,4.0,5.0,5.0,YES,Better,Approve,Netflix,NFLX,COMPANY_PUBLIC,4700,8830669000,Internet,Information Technology,"Great Benefits, subsidized lunches, free fruit and coffee, lots of PTO, free Netflix acct, community involvement, company culture, internal growth","Only 3 tardies/early leave per year before separation, no tuition reimbursement, very strict about what can be at your desk, no holidays off, headsets provided are awful","Keep moving the site in the right direction, and start interviewing for CSR2's soon!"
13817224,11891,53292476,FEMALE,,,0,,0,,1,0,,,,,,2017-02-16 18:11:13.943,1,,4.0,2.0,5.0,5.0,5.0,5.0,YES,,,Netflix,NFLX,COMPANY_PUBLIC,4700,8830669000,Internet,Information Technology,"Other than the benefits, the environment you work in is very relaxed, while still maintaining professional boundaries. Management is easy to work with, feedback is more constructive than criticizing","Lack of upward growth/opportunity, you'll definitely get the unreasonable customers",
14154660,11891,53911659,FEMALE,1989.0,BACHELORS,755,Salt Lake City,255,UT,1,60210,Customer Service Representative,customer service representative,1.0,customer service,1.0,2017-03-12 16:41:20.147,1,,1.0,1.0,3.0,1.0,1.0,1.0,NO,Same,Approve,Netflix,NFLX,COMPANY_PUBLIC,4700,8830669000,Internet,Information Technology,"No pros, everything that made me like the job was a blatant lie. Has health insurance so that's something.","The work is monotonous and draining. The chat team was dissolved, and then they shifted my hours to meet 'business needs' which took away the last bit of faith I had that they care about the employee. Supposedly you can choose from set shifts, but the time you pick is randomly assigned, meaning if you're randomly assigned to pick last, then there are no good options left. Could also mean that you work there for 2.5 years like my coworker and never get to have a weekend day off. 
In training they told us over and over again that top performers were promoted within 3 to 6 months but there have literally been no opportunities. They said numbers didn't matter, they promised unlimited time off, and a whole host of other perks. That has all been blatantly false, the entire job is a numbers game, you sit glued to your desk waiting for a coaching or meeting to break up the nightmare of the day but those keep getting pushed off to the future, which never happens. Unlimited time off was taken away, and you could be fired for a whole host of silly reasons, I myself have seen multiple coworkers walked off the floor for minor infractions, and the new policy of only 3 tardies (which could be 1 minute late) per YEAR is punitive. Even the free drinks are slowly being taken away, we have stupid lemon water options now or espresso, which I can't drink. This job has given me anxiety, I am actively looking for a different job and will quit the moment I'm able.","Don't lie to your employees, hire enough people so that you're not glued to the phone with back to back calls all day, promote an option of breaking up the work day instead of sitting stuck in the cubicle. You can't even take personal time for crying out loud, you get in trouble for needing to take a 2 minute bathroom break outside your schedued break time. Ive never had a job that so horrendously micromanages time to be sure you're getting every last second of work from the employee. Actually be truthful about advancement opportunities. I was told CRS2 would be avaliable August of 2016, that got pushed to January of 2017, then March of 2017, and now maybe 6 months into the future. That's ridiculous, and it has created a dead end job culture that there feels like no escaping from."
14203724,11891,50320497,MALE,1986.0,BACHELORS,755,Salt Lake City,255,UT,1,60210,Customer Service Representative,customer service representative,1.0,customer service,1.0,2017-03-15 16:29:18.58,0,2017.0,3.0,2.0,4.0,4.0,3.0,4.0,YES,Better,Approve,Netflix,NFLX,COMPANY_PUBLIC,4700,8830669000,Internet,Information Technology,"Free Netflix
Cafe on sight, moderately priced
Free coffee and peanut m&m's
Good health and dental benefits
Very transparent
No dress code (using good judgement)
You can flex your on the clock breaks
Pay is above market","Attendance policy is strict
Little room for advancement
Calls from very uneducated and slow people needing help with their Netflix
Not much room for shift changing to earlier shifts (only night shifts available)
It's ""not scripted"" although there are many things you must do verbatim
Calls are very repetitious",
7509119,11891,30587396,MALE,1979.0,ASSOCIATES,761,San Jose,2280,CA,1,1054473,Global Support Technician,support technician,0.9110000133514404,product support,0.9110000133514404,2015-08-08 22:06:53.87,0,2015.0,4.0,4.0,5.0,5.0,5.0,5.0,YES,Better,Approve,Netflix,NFLX,COMPANY_PUBLIC,4700,8830669000,Internet,Information Technology,"Great people, fun place to work.",Nothing bad to say,NO MORE SHIFT CHANGES..
7650075,11891,26285399,FEMALE,1987.0,BACHELORS,234,Denver,2519,CO,1,60233,Customer Service Representative I,customer service representative,1.0,customer service,1.0,2015-08-19 16:47:59.177,0,2015.0,1.0,2.0,1.0,1.0,1.0,3.0,NO,Worse,Disapprove,Netflix,NFLX,COMPANY_PUBLIC,4700,8830669000,Internet,Information Technology,"The environment is high energy and the people are very friendly. They have a lot of games and videos, as well as devices to occupy your free time. It is extremely DIFFICULT to get fired. Which means that if you do get fired then you SERIOUSLY and imaginably screwed up.","Your base PAY as of 2014-2015, as you are contracted out and paid by 24/7 is at the most 12.00 an HOUR! I do not know how Glassdoor came up with $15.

You are verbally abused everyday by the customer. The technology and the Knowledge base can chance on you, so you need to be extremely adaptable.

If someone starts calling you names, you can not hang up and you can not make outbound calls.

You are held to metrics and those standards are extremely difficult to maintain unless you have been working in a call center for 5 years. If you do not perform you will be written up.

One of those metrics is your call back rate, handle time (less than 5 and 1/2 minutes) and DSAT's (less than 4%) which translates into 1 NO in the survey.

Attendance is non-negotiable. I was sick for 9 weeks (I had my voice for less than 25% of the time) and I even brought in a doctors note explaining my situation and I STILL got written up. 

They have shift bids, which means that every 6 months you can bid for a new shift. If your metrics are mediocre or bad, then you will be moved to what every shift they give you. Most places try to put you in shift according to your requests and needs. This is not that place. You can bison your own shift...and possibly keep it. My call center lost half of their work force due to the previous shift bid. They said they were going to try and change it to make it more ""fair"", but when I left, they can completely removed my shift time.

They did NOT tell me about shift bids when they hired me.

If you try for CSR 2 and don't meet the standard by day 90, you will lose your job. You do not go back to CSR 1 or given another chance.

iF YOU want to TRADE, then the person you trade with has to be approved by your team lead and theirs...and vise versa. I switched shifts with someone else, I put up 3 people before I found someone acceptable. The shift took 3 months to process due to a lack of organization. 

If you do not mind being a punching bag, emotionally and verbally...then this is the job for you!",Better and longer training.
