reviewID,employerID,userID,gender,birthYear,highestEducation,metroID,metroName,stateID,stateName,countryID,jobTitleID,JobTitle,GOC,GOCconfidence,MGOC,MGOCconfidence,reviewDateTime,isCurrentJobFlag,jobEndingYear,OverallRating,CareerOpps,CompensationBenefits,SeniorLeadership,Worklife,CultureValues,RecommendFriend,BusinessOutlook,CEO,employerName,stockTicker,employerTypeCode,numberEmployees,annualRevenue,industry,sector,pros,cons,feedback
991962,11891,1313564,,,,700,Portland,3163,OR,1,60210,Customer Service Representative,customer service representative,1.0,customer service,1.0,2011-06-22 12:19:06.41,0,2010.0,1.0,1.0,2.5,1.0,1.0,,NO,,Disapprove,Netflix,NFLX,COMPANY_PUBLIC,4700,8830669000,Internet,Information Technology,"Free Easy Mac, Tea, Oatmeal & Cup O Noodles
Free Netflix Subscription","The people working here are so ridiculous and the trainer is straight from Sesame Street.

I knew one of the first 6 people to open the center, and she had been laid off over a year prior to when I started. She had some horror stories, but I thought the pay would overshadow any hint of doubt I had.

I made them aware of the fact that I was in school [college, obviously] prior to being invited to the interview, and they said that was fine & they'd work with me (I found out later that this is a complete lie). I went through training and everything with positive feedback. Only after that did it become an issue, and I was constantly pulled aside and berated. I am not going to quit school to slave away at a job that will last less than a year. They pulled me into random rooms around the call center and told me my ""internet browsing privileges were being taken away during my breaks,"" because I looked up Netflix reviews. I was told that my face looked ""sad and depressed."" Well, of course it was after you pulled me into a room 3 times in one day trying to make me feel bad about going to school.

They expect you to talk to 85-year-olds with Alzheimers that can't even remember their email address, let alone their name, and help them fix whatever issue they have in less than 5 minutes.

Why is there free food? Why are there showers here? Why are there laptops for you to use? Because they want you to eat, sleep and breathe Netflix.","People are human. Netflix has no human aspect to it.
When I first started, everyone there was worried about their job, although most of them were recently promoted. That's horrible. Start investing in people so you don't waste money on training.

Don't say things that can bring a lawsuit to your door.

Don't hire people in school.

Don't expect newly trained employees to know all of the answers when your trainers don't even know the answers."
1045162,11891,1420629,,,,700,Portland,3163,OR,1,126998,CSR-1,inventory specialist,0.912999987602234,inventory specialist,0.912999987602234,2011-08-01 17:37:32.36,1,,3.0,1.5,3.0,3.0,2.5,,,,No Opinion,Netflix,NFLX,COMPANY_PUBLIC,4700,8830669000,Internet,Information Technology,"-fun work environment (IF you have a good team, and manager)
-good location","-high stress 
-high turnover
-no communication between ops and CSR's when new things are launched 
-constant fear of doing something wrong 
-there is no way that we can 'relate', 'assure', make the customer feel good, and fix their issue in under 4 minutes and 30 seconds (and get a Yes response 95.5% of the time)",Better communication about new NRD's or other things being launched.
1068018,11891,1466273,,,,759,San Francisco,2280,CA,1,41073,Director of Marketing,marketing manager,1.0,marketing manager,1.0,2011-08-17 15:30:12.817,0,2011.0,5.0,5.0,5.0,5.0,5.0,,YES,,Approve,Netflix,NFLX,COMPANY_PUBLIC,4700,8830669000,Internet,Information Technology,"A go-go place that is well-run and exciting.  Until the recent blowback on pricing, it was (and still is) a great place that everyone recognizes.  Engaging, valuable projects were constantly being pursued.  Really loved the Marketing team and the relationship with the other departments!","Not for the faint of heart.  If you seek a place to hide, you won't last long here.  Other than that, it is hard to not have loved working for a company that has great products and management.","Love your vacation and sick leave policy, no limits based on the work you achieve.  I am not certain if they can keep it up as they get bigger, but hope you can!"
1072079,11891,26932,MALE,1970.0,HIGH_SCHOOL,700,Portland,3163,OR,1,64221,Supervisor,manager,1.0,branch manager,1.0,2011-08-20 12:57:13.23,0,2011.0,1.0,1.0,3.5,1.0,1.0,,NO,,Approve,Netflix,NFLX,COMPANY_PUBLIC,4700,8830669000,Internet,Information Technology,Free monthly subscription.   Good money but daily multiple firings are reminders of why Unions exist.,Upper management is not not consistent.  For every one good Manager....you have 3 horrible ones. Not very good odds.  :(,Fix your issues...don't just fire everyone that does not fit to your company mold.  You would be amazed at how many different ways there are to accomplish a task.
1153102,11891,1640238,,,,761,San Jose,2280,CA,1,0,,,,,,2011-10-13 16:19:51.49,0,2011.0,3.0,4.0,4.5,1.5,5.0,,NO,,Disapprove,Netflix,NFLX,COMPANY_PUBLIC,4700,8830669000,Internet,Information Technology,"No vacation policy and flexbility. High pay, which is meant to replace some of the perks that other companies offer. Interesting and fun industry.  Employees are smart and work as a team for the greater good.","The ""freedom and responsiblity"" culture works for some, as long as you do not disagree with management.  There is very high turnover. When people are let go, they are surprised.  People are afraid to make mistakes, which makes for a stressful enviroment.  I have never felt comfortable working there.  Management is out of touch with its customers and makes hasty decisions that contradict common sense.  Employees suffer because of this.  Why would the former CFO leave when the stock on its way to its peak?",Your employees are valuable resources.  Treat them as such.
1212897,11891,35955,,,,761,San Jose,2280,CA,1,17959,Senior Software Engineer,software engineer,1.0,software engineer,1.0,2011-11-23 14:45:36.763,1,,2.0,1.0,3.0,2.5,3.5,,NO,,Disapprove,Netflix,NFLX,COMPANY_PUBLIC,4700,8830669000,Internet,Information Technology,"It's a decent JOB (emphasis on purpose) if you are looking for a heads down, monotonous coding job. If you can manage a decent amount of work and the perspective, you will have a stable pay check.","I was sold on all the culture stuff  and drank the cool-aid at first. After spending a lot f time at Netflix, my perspective has changed for the worse. What good is the sales pitch if you can't deliver. 

Some organizations are terrible (i am not talking about IT/ back-office type group) when it comes to  recognizing people, allowing (forget about encouraging) their growth. No carrer, no recognition. In a way, its a career dead-end. Its a JOB.

Recent break-neck hiring has bought in a TON of managers (e.g. instead of bringing in 1 project manager, they've hired &gt;1 managers). Believe it or not, it takes 4 times the amount of meetings (compared to 2 years ago at Netflix) to get 1/2 of what we used to get done in the same period of time.

Today, all of the talk about culture (except firing people for no good reason), freedom etc are just BS.

No family insurance (medical, dental etc). Company only pays for the employee but in reality, they don't care.","Apparently, top management (who've been at Netflix forever) thinks engineers who's been at Netflix for more than a couple of years is ineligible move into a management role because they won't be able to hire people. Seriously. Again, this seems to be applied differently in different organizations.

i would love to hear from the management about what data they have to back this up this bs.

Another career killer: Hire people who 'know' their job i.e. an engineer converting to a manager means that person has to 'learn' how to be a manager. Given all the recent (Q4 2011) news about Netflix, decide for yourself about the management 'knowing'."
1313705,11891,1718256,,,,761,San Jose,2280,CA,1,17959,Senior Software Engineer,software engineer,1.0,software engineer,1.0,2012-01-31 23:12:44.783,0,2011.0,3.0,3.0,4.0,1.0,2.5,,,,Disapprove,Netflix,NFLX,COMPANY_PUBLIC,4700,8830669000,Internet,Information Technology,The engineers are the smartest most capable bunch I have worked with in my career.,The executives have no clue how to run the company.  Their success is based on luck and they are proud to repeat the same mistakes over and over again.,Get a new marketing and PR team.
1347375,11891,2046190,,,,700,Portland,3163,OR,1,60235,Customer Service Representative II,customer service representative,1.0,customer service,1.0,2012-02-18 22:55:29.037,1,,2.0,2.0,3.5,2.0,1.0,,NO,,Approve,Netflix,NFLX,COMPANY_PUBLIC,4700,8830669000,Internet,Information Technology,"Pays well for a CSR job.  
Is full time immediately.
Two week training adequately prepares you for position.
Nice break area with complementary tea, coffee, fruit.
No dress code.  Wear whatever you're comfy in.
Friendly co-workers.
Pleasant work space- comfortable desks, chairs, clean appearance.
Breaks are CSR responsibility.  You have a schedule, but you decide whether it's best to go on break or take one more call.  
On extremely high call volume days (i.e. server crashes, etc.) managers show appreciation by coming around with a cart of beverages and snacks to keep you going.","While you are placed on teams to help you deal with any obscure technical issues that may arise, the teams aren't very supportive or responsive.  They love to BS in the chatroom, but when someone asks a real question suddenly it seems like no one is home.  On the rare occasions when you do have an escalated call that you can not resolve, supervisors avoid your messages in order to avoid dealing with the dissatisfied customer.  

There is very little positive feedback.  On days when I did everything correctly - 0% customer dissatisfaction (by survey response), low handle times, etc., the supervisor never said a word.  The moment you have a long call that pushes your time up, they call you on it.  Regarding any such poor performance: it was very common for embarrassment tactics to be used in response instead of constructive criticism.","Find better ways to recognize your good employees.  It's disheartening to continually get good stats and never get a pat on the back.  The silly workplace contests are nice, but the employees recognize them for what they are.

Get a better system in place for checking in on your supervisors, or a report system.  It's frustrating to see your supe getting away with playing games on facebook while you're working like mad."
1425810,11891,1861807,,,,700,Portland,3163,OR,1,60210,Customer Service Representative,customer service representative,1.0,customer service,1.0,2012-04-04 16:11:21.82,0,2012.0,1.0,1.0,2.5,1.0,1.0,,NO,,Disapprove,Netflix,NFLX,COMPANY_PUBLIC,4700,8830669000,Internet,Information Technology,"Free bananas, apples, coffee. Low priced soda. Free Netflix account. I worked with (not for!) some amazing people. If your supervisor likes you, you will be treated very well and have some degree of leniency when it comes to meeting stats and time spent on the phone.","Pretty much everything else not noted above. Most days the ""What's working?"" list is shorter than the ""What's broken?"" one.

No communication between departments. Customer service is forced to make things up because the Netflix ""engineering"" or ""research"" teams don't give any sort of information to the reps regarding estimated time to service restoration during outages. I put engineering and research in quotes because, as a CSR, you never actually speak to them. They are merely referenced, like mythology or fairy tales.

Reps are given goals that are nearly impossible to consistently meet, in what I believe to be a fairly obvious system that gives Netflix an opportunity to fire virtually any employee for not hitting their metrics. You basically are there by the grace of your boss, if they want to find a reason to get rid of you it will be fairly easy for them to do so.

The customer dissatisfaction is worded in such a way that many people are leaving feedback on Netflix, not the individual rep, but this DSAT number must be below a certain percentage or you risk losing your job. You are basically encouraged to burn through as many calls as quickly as possible, placating the customer or flat out lying to them (blaming their ISP, home network, or device manufacturer) enough that they'll be compelled to say that they're satisfied after you say ""please stay on the line for a one question survey"" and then promptly hang up on them. 

There is absolutely no way that you are going to have consistent, quality interactions in 4:30 minutes or less, ESPECIALLY after the missteps that Netflix has made this year. But if your numbers drop, or you spend too much time trying to help out, be prepared to be ""coached"". 

Coaching is such an absurd term, because it implies that there is a sort of team camaraderie or human aspect. My last coaching session with my boss involved being told that I was not giving my all. I was only supposed to be a contractor for 59 days. I was supposed to have health insurance by now, and some security as an employee. Instead we are told that they can only afford to hire on so many people, and better luck next time, but you're welcome to stay on as a temp if you like! So yes, I don't really feel like giving my all. Despite putting in consistently good numbers, multiple people on my team have told me (independently) that they are afraid of being fired at any time.

I get the feeling that many people are there only until they find something else. Netflix was actually a considerable pay cut from my last job, but even if the pay was higher the way they treat their employees is at the top of the list of the worst employers I've ever personally experienced. Work / life balance is non-existent. While going through some personal issues in my life, my supervisor told me to ""leave it behind me"" when I walked in the door, not offering anything close to a compassionate response.

One last observation: the people I've noticed who seem to be TRULY happy there are the ones who are too young to know any better. I'm not old by any means, but I'm also not an 18-24 year old kid who doesn't realize that jobs don't need to be like this, that you can actually be treated like a human being and be *inspired* to perform, rather than doing it because you fear for your job on a daily basis. Eventually Netflix will chew them up and spit them out, too. Ask yourself why anyone should give loyalty to a company where an employee celebrating a 6 month anniversary is considered a veteran? 

Also, the positive reviews on here are probably left by Netflix management. It cites things they don't even offer anymore at the Hillsboro facility (like free mac&cheese, and, oh I dunno, BENEFITS for most of the people here). You will most likely be a temp with Netflix (meaning no benefits) until you quit or get fired.

I've been lucky enough to work for some truly amazing companies, and Netflix is definitely not one of them.","This is simple. Learn to communicate. Start treating your CSRs like human beings. Stop encouraging CSRs to lie to customers. Tucking tail and rescinding your decision to split the company doesn't magically make you a ""feedback driven company"", it means that you got called out on BS and you're backpedalling."
1437467,11891,2419847,,,,700,Portland,3163,OR,1,126998,CSR-1,inventory specialist,0.912999987602234,inventory specialist,0.912999987602234,2012-04-10 22:20:26.227,0,2012.0,2.0,1.5,4.0,1.0,1.0,,NO,,Disapprove,Netflix,NFLX,COMPANY_PUBLIC,4700,8830669000,Internet,Information Technology,"Well-paying for a call center, free fruit, cheap soda, a nice building, free Netflix.","Your work experience almost depends entirely on your manager, and your manager may or may not change every month.  Things that one manager may not care about (and tell you not to worry about) will be brought up against you six months later as a final warning.  Sometimes policies are suggestions and other times they are concrete, and this will change at random and get you terminated.  This isn't just on the ground floor either, one day everything's fine and the next ten managers are let go and their teams dispersed amongst the remaining set (but everything's still fine guys, don't worry).  There is almost zero room for advancement, managers are hired in from the outside and the best anyone hired at entry-level can expect is to become a CSR-2, a position that doesn't actually pay more.  Anyone and everyone competent seemed to slowly leave for better jobs in my time there, and at first I wondered why when they had so much going on, but eventually I figured it out.

Decent pay if you can stick it out, but way more stressful than it needs to be, and I'm not talking about the customers; an old man yelling at you for thirty minutes because his blu-ray stopped working is nothing compared to not knowing if you're going to be fired that week because you had a sick day three months ago and your calls aren't short enough.",Act less like the captains of a sinking ship.
1450253,11891,2478812,MALE,1974.0,BACHELORS,761,San Jose,2280,CA,1,0,,,,,,2012-04-17 09:44:31.147,1,,4.0,3.5,4.5,4.0,5.0,,,,Approve,Netflix,NFLX,COMPANY_PUBLIC,4700,8830669000,Internet,Information Technology,"Your peers are excellent and from all walks of life
Training is encouraged and done well
work/life balance exists",this is not a long term choice and the culture deck is true,
1472362,11891,1343345,,,,761,San Jose,2280,CA,1,4279,Software Engineer,software engineer,1.0,software engineer,1.0,2012-04-27 13:28:18.707,0,2012.0,1.0,1.0,3.5,1.0,2.0,,NO,,No Opinion,Netflix,NFLX,COMPANY_PUBLIC,4700,8830669000,Internet,Information Technology,"You might work with some very bright people and make good friends
Opportunity to learn  some very interesting skills and technologies
Above market salary as long as it lasts","You might get all verbal accolades and encouragement till one fine day you are told that you are no longer needed!
Managers could be picked randomly based on seniority from your peers if one leaves and may have little people skills.
Firing, if it happens to you, is public, humiliating and outright insulting with a terse broadcast email.

Advice to potential applicants:
- Do not close your eyes to all the reviews on Glassdoor, thinking you are too smart too be fired
- Do account for the potential time you might have to stay without job while comparing the salary to other places",Treat your employees with respect.
1602269,11891,2865288,MALE,1970.0,BACHELORS,761,San Jose,2280,CA,1,59897,Creative Director,creative manager,1.0,designer,1.0,2012-06-14 07:39:47.337,1,,5.0,5.0,5.0,5.0,4.0,5.0,YES,Better,Approve,Netflix,NFLX,COMPANY_PUBLIC,4700,8830669000,Internet,Information Technology,Innovation is not hampered by unnecessary process. Designs are not approved by executives or committee they are approved by the users. This is an environment that promotes creativity.,You must be able to let your work go. For every test that wins 4 other designs fail. Being able to learn from designs that fail is difficult to do when you are emotionally invested in them.,"Give highly talented, less experienced, candidates an opportunity to interview. Raw talent, in a fully formed adult, at a great company yields great results."
1672509,11891,6113258,MALE,1985.0,BACHELORS,700,Portland,3163,OR,1,126998,CSR-1,inventory specialist,0.912999987602234,inventory specialist,0.912999987602234,2012-06-29 15:35:40.667,0,2012.0,2.0,1.0,4.0,1.0,3.0,1.0,NO,Worse,Disapprove,Netflix,NFLX,COMPANY_PUBLIC,4700,8830669000,Internet,Information Technology,Free account good people supervisors when not being forced to d e'er ink the cool aid were very good,Never on the same page upper management lies was told multiple times even the day before that my job was safe woke up the next day and was jobless.,Don't lie to employees and stop blaming poor company decisons on your employees as a reason to let them go
1770771,11891,8690293,MALE,1965.0,BACHELORS,761,San Jose,2280,CA,1,40730,Director,manager,1.0,branch manager,1.0,2012-07-25 10:38:00.707,0,2010.0,3.0,3.0,5.0,3.0,2.0,1.0,NO,Same,Approve,Netflix,NFLX,COMPANY_PUBLIC,4700,8830669000,Internet,Information Technology,"- great physical work environment in Los Gatos
- great co workers: highly motivated, intelligent, impressive experiences. Netflix hires people at the peak of their games
- at the time (2007-2010), it was an exciting time of growth in the online streaming space, with consistent growth in the DVD space; fun to be on the cutting edge, and high growth.
- great compensation; employees are well paid","- there is a constant sword of damocles (i.e. the threat of removal) hanging over your head. even when you think you are doing well, you can be released unexpectedly, at a moment's notice. (this results in a culture of fear)
- there is no career path; Netflix hires you to perform a job, and once that job is over, it's easier for them to let you go rather than retrain or relocate you.
- this is not the place to be if you want work/life balance; not family friendly","- missteps from a year ago (i.e. 2011 - Qwikster) have caused a loss of confidence in management
- there are still lots of people in the US that want to rent DVDs; much better selection, and much better accessibility. It feel like Netflix is now content to ignore them and move on. What happened to the great customer service that built the brand?"
1793843,11891,1926167,,,,700,Portland,3163,OR,1,356449,Netflix Customer Service Representative,customer service representative,0.9110000133514404,customer service,0.9110000133514404,2012-07-31 13:40:28.713,0,2011.0,2.0,2.0,1.0,1.0,2.0,2.0,NO,,Disapprove,Netflix,NFLX,COMPANY_PUBLIC,4700,8830669000,Internet,Information Technology,"Free food handed out a lot, casual dress code, lots of people in their 20s that you can relate to.","Very confusing attendance policy. If you're not a permanent employee yet basically, you miss a day or two, they'll fire you. Very little support from upper management when dealing with customers. Impossible sometimes to get assistance with problems though they advise that you get their help when needed. I was so stressed from continuously being threatened by my supervisor that I might lose my job I couldn't stand it. If you want to have any sort of healthy work environment, don't work here.",Figure out an attendance policy and stick to it & be absolutely clear. Don't treat your employees like they don't matter either. People will find out & not want to give you business.
1844793,11891,1871412,,,,700,Portland,3163,OR,1,60210,Customer Service Representative,customer service representative,1.0,customer service,1.0,2012-08-14 10:23:36.06,1,,1.0,1.0,1.0,1.0,1.0,1.0,NO,Worse,Disapprove,Netflix,NFLX,COMPANY_PUBLIC,4700,8830669000,Internet,Information Technology,Free Netflix account. You also get free self-worth and self-esteem draining sessions with management.,Insane high turn-over. Lack of support from management..,
1887364,11891,11370594,MALE,1968.0,BACHELORS,700,Portland,3163,OR,1,368590,Instant Watch Customer Service,,0.0,,0.0,2012-08-26 09:41:17.617,0,2008.0,4.0,3.0,4.0,3.0,3.0,4.0,YES,Worse,No Opinion,Netflix,NFLX,COMPANY_PUBLIC,4700,8830669000,Internet,Information Technology,Pay was excellent.  All of the tools were available to do the job that needed to be done.,"Many customers did not understand how to use Instant View, and it was often difficult to explain.",
1952742,11891,240058,FEMALE,1979.0,BACHELORS,761,San Jose,2280,CA,1,0,,,,,,2012-09-14 00:11:01.147,0,2012.0,2.0,3.0,5.0,1.0,2.0,2.0,NO,Same,Disapprove,Netflix,NFLX,COMPANY_PUBLIC,4700,8830669000,Internet,Information Technology,"•  Great compensation package
•  Free lunch
•  Free cell phone","•  The company culture is very cold hearted, they let people go ALL THE TIME, sometimes for good 
   reasons, most of the time not. 
•  The environment is extremely political that makes it hard to focus on doing a good job.
•  A lot of employees are rather negative about the workplace and very open about looking for a job.",
1963639,11891,843300,FEMALE,1969.0,BACHELORS,761,San Jose,2280,CA,1,63697,Manager,manager,1.0,branch manager,1.0,2012-09-17 16:06:01.643,0,2011.0,2.0,2.0,4.0,2.0,4.0,2.0,NO,Worse,Disapprove,Netflix,NFLX,COMPANY_PUBLIC,4700,8830669000,Internet,Information Technology,"-Freedom and Responsibility
-Able to telecommute","-Very (VERY) cut throat
-Upper management doesn't support staff
-HR allows upper management to oust existing employees when a new director is hired and wants to bring his former staff over","-Show a little more respect towards employees that actually follow the company values and culture
-Management does not practice what they preach (my 360 review from my manager was awesome, however, I managed to hear through the grapevine that he was unhappy with my performance)"
1988080,11891,12951368,MALE,1970.0,BACHELORS,508,Los Angeles,2280,CA,1,54464,Director of Content,content manager,1.0,marketing manager,1.0,2012-09-25 04:40:29.297,0,2010.0,4.0,4.0,5.0,4.0,5.0,4.0,YES,Better,Approve,Netflix,NFLX,COMPANY_PUBLIC,4700,8830669000,Internet,Information Technology,"Netflix's commitment to attracting highly-motivated, creative thinkers throughout the organization means clever solutions and great ideas can come from anywhere at anytime.",There is a certain pressure to perform that comes from the level of freedom granted that results in a percieved sink or swim mentality.,"When I left, there was very little reward or recognition given to managers who mentored or successfully developed staff."
