reviewID,employerID,userID,gender,birthYear,highestEducation,metroID,metroName,stateID,stateName,countryID,jobTitleID,JobTitle,GOC,GOCconfidence,MGOC,MGOCconfidence,reviewDateTime,isCurrentJobFlag,jobEndingYear,OverallRating,CareerOpps,CompensationBenefits,SeniorLeadership,Worklife,CultureValues,RecommendFriend,BusinessOutlook,CEO,employerName,stockTicker,employerTypeCode,numberEmployees,annualRevenue,industry,sector,pros,cons,feedback
2448769,11891,472492,PREFER_NOT_TO_STATE,,,761,San Jose,2280,CA,1,17959,Senior Software Engineer,software engineer,1.0,software engineer,1.0,2013-03-10 21:09:53.177,1,,5.0,3.0,5.0,4.0,3.0,5.0,YES,,Approve,Netflix,NFLX,COMPANY_PUBLIC,4700,8830669000,Internet,Information Technology,"Brilliant co-workers, opportunities to have a direct impact, minimal nit-picking bureaucracy or corporate policies, dynamic energy as the company continually evolves.   Company does pretty well as removing doofuses and not hiring jerks.  For the saavy employee, you can move into some great opportunities as the company grows and adapts.  Upper management is very transparent (even when sometimes they don't make the best call -- e.g. Qwikster).","Dynamic environment does not work for a 'do my work and go home' employee or those who just want to show up and be told what to do.  Middle and lower management can be a crap shoot -- seek out a great boss (there's many at Netflix) and avoid the bad ones (unfortunately, Netflix has those too).   There is a level of 'playing the game' but not to an extent that I'd say is greater than anywhere else.  Corporate philosophy does not emphasize coaching (but does not ban it) -- so you need to seek out your own mentors or strengthen your team (if you're a lead) by figuring out career/skills grown on your own.",
2468160,11891,710612,,,,761,San Jose,2280,CA,1,17959,Senior Software Engineer,software engineer,1.0,software engineer,1.0,2013-03-15 23:39:59.31,1,,2.0,2.0,3.0,1.0,3.0,1.0,NO,Same,No Opinion,Netflix,NFLX,COMPANY_PUBLIC,4700,8830669000,Internet,Information Technology,"* Best place if you just want to work with great technically capable folks.
* 15-20% higher pay but if you actually consider everything, it might not be that big of a deal. Check what will be in-hand salary after taxes because taxes also go high with salary.
* Somewhat transparent workplace but at times higher management takes ridiculous decisions like Quickster, what the hell....
* Reed gets thing right most of the time (except Quickster) and understand what he is doing.","* Worst place where all technically capable folks are also so heavy on political games within the team. Also it depends on which team you are part of. My general observation is, larger the team greater the politics being played within.
* IT IS LITERALLY TRUE THAT IT IS CULTURE OF FEAR, no matter how talented you are. I have seen ppl being walked out they were far more talented than other mediocre engineers surviving there for 3-4 years just because they lick the managers a*s and I have seen managers loving it being licked :)
* Few managers who came from Google or some other similar companies, think that they know everything in the world and act as if they rule the world but actually they are literally dumb a*s when it comes to real work.
* They claim it is all rockstar engineers and the fire who are not but I have seen ppl surviving for ages not even knowing what they did for all these years at Netflix and they are pure mediocre engineers.
* My advice to engineers would be if you are happy with the work what you are doing right now or with other offers in hand, don't fall for the salary trap, it is merely an illusion.","* Gets rid of all mediocre managers, directors and those stupid engineers.
* Change the culture of fear from its root because that creates so much politics inside. I have never seen such a political environment in my 10 yrs career."
2506562,11891,1512093,,,,761,San Jose,2280,CA,1,60210,Customer Service Representative,customer service representative,1.0,customer service,1.0,2013-03-27 15:46:05.123,0,2013.0,3.0,4.0,5.0,3.0,3.0,1.0,YES,Same,Approve,Netflix,NFLX,COMPANY_PUBLIC,4700,8830669000,Internet,Information Technology,"free food, and flexible scheduling is promoted, although in a call center, this schedule flexability is not really existent. Senior and Middle management try their best to be honest and forthcoming.
If you want something you can ask anyone and they can probably get it for you if you work for it.
Believe in promoting from within, and encouraging you.","truthfully, their open door policy on who's getting fired, or what changes are happening can be somewhat stressful at times. you don't feel a sense of job security. their feedback oriented management style just feels pressure-some. 

Netflix is a team. A sports team. an ambitious and cut throat team who will trade you off if they see you're not an asset any longer, rather than encourage you to move cross functionally.",
2517377,11891,18688383,MALE,1962.0,BACHELORS,700,Portland,3163,OR,1,60210,Customer Service Representative,customer service representative,1.0,customer service,1.0,2013-03-31 14:50:08.907,0,2011.0,1.0,1.0,4.0,3.0,3.0,2.0,NO,,No Opinion,Netflix,NFLX,COMPANY_PUBLIC,4700,8830669000,Internet,Information Technology,"Good pay, decent benefits. At least it's not Cambodia",There are so many I don't know where to start.,"Treat your employees as assets, not like the doormats you wipe your boots on."
2539784,11891,18654486,FEMALE,1984.0,BACHELORS,218,Dallas,1347,TX,1,60210,Customer Service Representative,customer service representative,1.0,customer service,1.0,2013-04-07 21:57:37.563,0,2013.0,3.0,3.0,4.0,3.0,2.0,4.0,,Same,Approve,Netflix,NFLX,COMPANY_PUBLIC,4700,8830669000,Internet,Information Technology,"Good pay, benefits, and relaxed atmosphere.","Customer service in general.  For some reason going into this I did not think it would be a typical customer service experience based on my own satisfaction with Netflix for the past 3 years.  It's pretty easy work, but so many people who called were lazy and/or arrogant jerks.  Some of them made me feel like I was an inch tall.  It was emotionally draining, especially for someone as sensitive as I am.  The pressure to meet the 0% DSAT also didn't help.  The survey asks about the company but it's answer is a reflection of the customer service and high DSATs effect job performance.  We're expected to convey a relaxed, friendly attitude and build a personal rapport with the customer, but with pressure of the DSAT it's hard not to make everything sound forced and phony because you want to really turn it on to try get a yes out of the person.  I'm an introvert so faking conversations and trying to think of chit-chat was hard for me. Do not take this job if you're sensitive and don't have strong conversational skills.  You must get to know the person. It is required.  I also wanted to add that the schedules and team leaders are constantly changing. It's extremely frustrating.",Change the survey question.
2723350,11891,20060958,MALE,1974.0,BACHELORS,761,San Jose,2280,CA,1,525653,Senior Manager Content Accounting,accounting manager,0.9110000133514404,accounting,0.9110000133514404,2013-06-10 15:18:42.877,1,,5.0,3.0,5.0,4.0,5.0,5.0,YES,Better,Approve,Netflix,NFLX,COMPANY_PUBLIC,4700,8830669000,Internet,Information Technology,"1) Great culture and people. 
2) Lots of freedom with appropriate level of responsibility. 
3) Pay top of market.
4) No vacation policy which adds to the freedom.
5) Love the business we're in and how we're changing an industry
6) No politics or at least not very noticeable
7) Again, great people!",1) No more ESPP offered,1) Bring back ESPP
2829006,11891,20596187,,,,761,San Jose,2280,CA,1,40730,Director,manager,1.0,branch manager,1.0,2013-07-17 00:50:45.263,1,,5.0,4.0,4.0,4.0,4.0,5.0,YES,Better,Approve,Netflix,NFLX,COMPANY_PUBLIC,4700,8830669000,Internet,Information Technology,"Incredibly talented, smart, driven coworkers across every function of the organization. Unusually organized and efficiently run. Feel lucky if you get the opportunity to be part of such an amazing place and such an incredible time. It is rare.","New head of Talent is not the right person to be leading and shaping the culture of Netflix. There are many concerns echoed about her throughout the company and worries that with her at the helm, the sacred secret sauce will start to spoil.","Be critical throughout the leadership team in addition to the rest of the organization when it comes to A players. Also, it might be time to step back and reevaluate the way compensation is structured. Many folks have voiced being frustrated and dissatisfied in their roles but acknowledge they are paid higher than anywhere else so chose to stay."
2838570,11891,20526253,FEMALE,1989.0,HIGH_SCHOOL,700,Portland,3163,OR,1,60210,Customer Service Representative,customer service representative,1.0,customer service,1.0,2013-07-19 16:19:38.32,0,2013.0,1.0,1.0,4.0,1.0,3.0,1.0,NO,Worse,Disapprove,Netflix,NFLX,COMPANY_PUBLIC,4700,8830669000,Internet,Information Technology,"*Free netflix
*Nice facility that is kept up well
*Usual set work schedule 
*Pays a few dollars more than most places","During training they make you think that as long as you are taking feedback they give you then there is no worries about the score of the percentage of people that say ""no"" to the survey. In all reality though the survey rules everything. Even if you helped the person on the phone to the best of your abilities, we're super nice, educated them about the problem and they thought you were an awesome person by time you were done talking to the Customer is still going to say No to the survey if they are annoyed with how netflix works because the survey doesn't ask if the person on the phone helped you today? It asks are you satsified with your netflix experience. So, there was a lot of frustration where they had a lot of people listen to you and none of them could really tell you what you could have done better in that call to make the person say yes to the survey. So, they give you tips like start every call differently instead of opening the call the same way or saying the customer's name over and over to help them feel like they have a connection with you to say yes.",Stop focusing so much on if some one says no to the survey if you're not going to specifically ask if the representative helped the customer. I am sure they have fired a lot of good people due to the survey.
2909457,11891,318498,MALE,1983.0,MASTERS,761,San Jose,2280,CA,1,17959,Senior Software Engineer,software engineer,1.0,software engineer,1.0,2013-08-08 00:34:24.57,1,,2.0,1.0,4.0,3.0,1.0,2.0,NO,Same,Approve,Netflix,NFLX,COMPANY_PUBLIC,4700,8830669000,Internet,Information Technology,"Fairly New Technology, Smart Talent, Free food and iphones. This place will certainly wow you in technology and some of the best talent, Good compensation.","lousy vacation policy(get real, no vacation policy - no vacation), very stressful work environment, little to no career opportunities if you are hired as an engineer, Chaos everywhere - High Turnover always affects your work one way or the other.","About time you should check your champion badge, it may have expired. Qwikster was a debacle. But the hiring cycle afterwards brought some worse incompetent middle management. Open door policy and summary dismissals might have worked for us in the past when we were a DVD business, but it definitely is hurting us - Bay is a very small place. Your talent is leaving(or about to leave), others are simply not interested in working with us. If you dont believe me, ask why recruiters always have to bring talent from outside silicon valley. Promote openness, talent and healthy work environment - not mediocre middle management's words. Please bring back the culture from 3 years ago."
2914358,11891,3017679,MALE,1985.0,BACHELORS,761,San Jose,2280,CA,1,53413,User Experience Designer,ux designer,1.0,front end engineer,1.0,2013-08-09 07:34:46.627,1,,5.0,5.0,5.0,4.0,5.0,5.0,YES,Better,Approve,Netflix,NFLX,COMPANY_PUBLIC,4700,8830669000,Internet,Information Technology,"Best company culture I have ever seen. ""Freedom and Responsibility"" is their guiding phrase here and it is true. They expect you to do you job and give you the freedom to do it as you see fit. Have never felt more empowered as a designer.","Can get political in certain situations, but it is a large organization. Makes you grow to understand the business side of things.",
2938973,11891,18758986,FEMALE,1989.0,BACHELORS,0,,0,,1,0,,,,,,2013-08-15 15:53:56.143,0,2010.0,2.0,2.0,4.0,3.0,3.0,2.0,NO,Better,Approve,Netflix,NFLX,COMPANY_PUBLIC,4700,8830669000,Internet,Information Technology,"Good pay for the work, and benefits.",Average call center. Very high turnover,
2943153,11891,20968744,,,,0,,0,,1,0,,,,,,2013-08-16 15:01:59.747,1,,3.0,3.0,4.0,3.0,3.0,4.0,,,,Netflix,NFLX,COMPANY_PUBLIC,4700,8830669000,Internet,Information Technology,Friendly environment with many seasoned pros in the ranks.  Engineers and their designs are not subject to micro-management.  Very little policy or overhead.  Great compensation from a cash perspective.  Team orientation.,"While much of netflix is progressive, there's a lot of legacy software and practice you will have to deal with.  Beige cubes, plastic bottles and lunches paint a rather out-of-date office space approach.","Be more green: allow remote employees, open offices closer to population centers, stop all the plastic waste.  Force staff rotation particularly around troublesome technology."
2995251,11891,21114679,MALE,1981.0,BACHELORS,700,Portland,3163,OR,1,126998,CSR-1,inventory specialist,0.912999987602234,inventory specialist,0.912999987602234,2013-08-30 08:04:46.403,0,2011.0,3.0,3.0,3.0,2.0,2.0,2.0,NO,Better,No Opinion,Netflix,NFLX,COMPANY_PUBLIC,4700,8830669000,Internet,Information Technology,Great stock options and free movies,They love firing people for things that aren't under the employees entire control and micromanage like a mofo,Chill out- its just movies
3085390,11891,21406610,,,,0,,0,,1,0,,,,,,2013-09-22 23:07:20.5,1,,5.0,5.0,5.0,5.0,5.0,5.0,YES,Better,Approve,Netflix,NFLX,COMPANY_PUBLIC,4700,8830669000,Internet,Information Technology,"Netflix offers amazing co-workers, an exciting business, and the opportunity to work on cool technology problems. Employees (and the community) can contribute to open source projects. The mature workforce focuses on working hard but goes home and recharges at night.","If you're looking for dinners served at the office, you won't find those at Netflix. I wasn't looking for those things, so I would consider this a pro!",
3127596,11891,15101966,,,,700,Portland,3163,OR,1,60180,Customer Service Manager,customer service manager,1.0,customer service,1.0,2013-10-02 11:26:18.783,0,2012.0,5.0,5.0,5.0,5.0,4.0,4.0,YES,Better,Approve,Netflix,NFLX,COMPANY_PUBLIC,4700,8830669000,Internet,Information Technology,"If you do your homework ahead of time you will know that it is not likely that you will retire from Netflix.  If you didn't do it before hand and decided to work for Netflix and were shocked at its fast pace and rapid change then shame on you.  The company is exactly what it advertises itself to be.  

I completely enjoyed the team I worked with and all of the challenges we faced.  It has almost been a year and I can honestly say it was a great experience and I miss the folks I got to work with.  Netflix has chosen a unique path in regards to customer service and is willing to take new and or different approaches.  It is a rewarding experience to generate an idea and have that idea implemented within the same day.  Not everything we tried worked but many of things we utilized did work and were very rewarding in there success.  If customer service is your chosen profession you can learn a lot from working with this company and gain insight into what would improve an industry that has chosen a path of mediocrity and failure.",Qwikster...that pretty much says it all.,"I genuinely enjoyed the direct and honest conversations I had with peers, HR, and my boss.  This is something unique in my experience and I would hate to see that change.  Keep the cereal, fruit, ppt decks, video games, ping pong, and coffee going the reps love that."
3133168,11891,21558684,,,,761,San Jose,2280,CA,1,55668,QA Engineer,qa engineer,1.0,quality assurance,1.0,2013-10-03 13:48:59.737,1,,4.0,4.0,5.0,3.0,3.0,4.0,YES,Better,,Netflix,NFLX,COMPANY_PUBLIC,4700,8830669000,Internet,Information Technology,"- Constant Learning
- Keeps me on my toes
- not a process oriented company. Keeps things simple.",- moving too fast.  Chasing a moving target.,
3199839,11891,2877778,MALE,1960.0,BACHELORS,761,San Jose,2280,CA,1,40730,Director,manager,1.0,branch manager,1.0,2013-10-18 10:51:26.213,1,,5.0,5.0,5.0,5.0,5.0,5.0,YES,Better,Approve,Netflix,NFLX,COMPANY_PUBLIC,4700,8830669000,Internet,Information Technology,Management is not afraid to experiment and try new things. Rapid development. High trust culture. Inventing the future.,"If you don't like change, ambiguity or are uncomfortable in a place where you get to use your own judgement a lot, it wouldn't be a good fit.",
3220490,11891,1081941,MALE,1977.0,HIGH_SCHOOL,700,Portland,3163,OR,1,0,,,,,,2013-10-23 10:06:44.087,0,2013.0,2.0,1.0,4.0,1.0,2.0,1.0,NO,Worse,No Opinion,Netflix,NFLX,COMPANY_PUBLIC,4700,8830669000,Internet,Information Technology,"Used to be top of market pay.  No longer is, but still higher than average.

Free Netflix account.","The Hillsboro call center is shrinking dramatically. Management puts as much spin on this as possible but the reality is, opportunities to advance do not exist.

The ""Netflix culture"" is hyped constantly but is not actually practiced. You will survive if you can speak the buzz words fluently while shamelessly self-promoting yourself at all times and never questioning management. 

Everyone is under tremendous stress to protect their position for as long as possible.  Success in Hillsboro depends not on the quality of your work but upon your ability to spin the truth and play politics.",Management is not looking for advice.
3237933,11891,21853907,,,,700,Portland,3163,OR,1,45837,CSR2,,0.0,,0.0,2013-10-27 21:33:28.92,1,,4.0,2.0,4.0,4.0,3.0,4.0,YES,Same,Approve,Netflix,NFLX,COMPANY_PUBLIC,4700,8830669000,Internet,Information Technology,"competitive pay, relaxed environment, various workplace amenities","Large call volume, huge customer base means needing to be insanely adaptive, 'sink or swim' mentality; if you don't continually preform you will be replaced regardless of past performance",
3247429,11891,233616,PREFER_NOT_TO_STATE,1974.0,MASTERS,761,San Jose,2280,CA,1,17959,Senior Software Engineer,software engineer,1.0,software engineer,1.0,2013-10-29 19:22:33.0,1,,5.0,5.0,5.0,5.0,4.0,5.0,YES,Better,Approve,Netflix,NFLX,COMPANY_PUBLIC,4700,8830669000,Internet,Information Technology,"It's like working for a very well funded startup.
If you're good, this company will boost your career lightyears ahead.
Compensation and perks are just right. No lavish lunches, just good organic food to keep you focused on business. No laundry service. It's not taking over your life.
Very fast growing company. Lots of room to grow and lots of opportunity (if you look).
Visibility - top down, you see everything. There are no secrets in this company. Very helpful if you know how to use this to your advantage.","If you're not good, you won't survive here.
If you have issues with your people skills, you won't survive here.
If you need hand-holding, someone to constantly point you in the right direction, you'll be directed to the door (while holding your hand).
You'll have to manage your work/life balance. Some people just don't know what 'unlimited vacation' means.",Keep up the great work.
3258961,11891,21916812,,,,700,Portland,3163,OR,1,45837,CSR2,,0.0,,0.0,2013-11-01 11:35:18.96,0,2012.0,1.0,1.0,3.0,1.0,3.0,1.0,NO,Worse,Disapprove,Netflix,NFLX,COMPANY_PUBLIC,4700,8830669000,Internet,Information Technology,"Inexpensive health insurance
Unique work environment","Where do I start.... I am a highly educated, sharp, always employed individual and I found it very challenging to work for Netflix long-term.  I've been employed in restaurant management, accounting and retail (just to name a few) and this company was by far, the worst place I've ever worked.  At my youngest, I was a Merry Maid and I even found that much more enjoyable then slaving away to constant surveys, unintelligent callers and unrealistic expectations.  Forget about taking vacation- embrace ocassional, mandatory over-time.  Expect callers to personally threaten you and your family. Schedules constantly change to odd hours- no matter what your ""ranking"" in the center is.  Little or no promotion within.  I gladly chose to discontinue my employment with Netflix voluntarily and my quality of life has greatly improved.","SMH- if you've made it this far, you've drank the Kool Aid."
3302909,11891,20791351,,,,218,Dallas,1347,TX,1,56177,Call Center Representative,call center representative,1.0,customer service,1.0,2013-11-12 12:32:24.53,1,,4.0,5.0,5.0,3.0,2.0,3.0,YES,Better,Approve,Netflix,NFLX,COMPANY_PUBLIC,4700,8830669000,Internet,Information Technology,"Free netflix.no dress code, can eat, can use phone, friendly co workers",You nee people to take your survey and most people won't.,Its not fair that you fire people based on if enough people review them..
3367584,11891,22248295,MALE,1973.0,MASTERS,761,San Jose,2280,CA,1,54384,Director Engineering,engineering manager,0.912999987602234,engineer,0.912999987602234,2013-11-29 11:45:47.543,1,,4.0,4.0,5.0,3.0,4.0,5.0,YES,Better,Approve,Netflix,NFLX,COMPANY_PUBLIC,4700,8830669000,Internet,Information Technology,"Fast-moving. Few bureaucratic distractions. Willing to make big, disruptive changes quickly. The move to original content was smart and will propel growth well into the future.

If you function well in a meritocracy, then you will likely be successful at Netflix.","They're getting big, and that growth is adding pressure to sacrifice some elements of their culture that made them unique and a desirable place to work.

The quality of talent getting hired or promoted now is much less impressive than in the earlier years.

The environment is increasingly political, which may be related to the hiring/promotion of more average, less-impressive employees.",
3389249,11891,22224929,,,,700,Portland,3163,OR,1,60210,Customer Service Representative,customer service representative,1.0,customer service,1.0,2013-12-05 16:11:38.697,0,2009.0,2.0,2.0,3.0,1.0,2.0,3.0,NO,,No Opinion,Netflix,NFLX,COMPANY_PUBLIC,4700,8830669000,Internet,Information Technology,"Free movies, before the last set of layoffs there was genuine regard for employee satisfaction and feedback was often solicited not only to improve  business processes but also to gauge morale.  After a while, not so much...","Frequent layoffs. Whole departments got laid off at a time. I guess I should have figured how it was going to be when the entire management team save one manager was suddenly gone a few months after I had completed training, which btw was before the 2008 meltdown. The entire QA team was let go a few months later and the entire Tech support team shortly thereafter.",Seems as though it would be difficult to keep quality people if the company lays off entire departments.
3422711,11891,19818306,FEMALE,1955.0,ASSOCIATES,941,Worcester,3399,MA,1,85544,Hub Manager,,0.0,,0.0,2013-12-15 05:00:21.663,0,2013.0,1.0,,3.0,1.0,1.0,2.0,NO,,No Opinion,Netflix,NFLX,COMPANY_PUBLIC,4700,8830669000,Internet,Information Technology,Stock option plan was very good. IT department worked well with hubs.  Some hub managers were willing to work as team.,"Unrealistic expectations, super long hours, poor upper management skills, cold mechanical type company, not very team oriented, uncomfortable company to work for.",Stand behind what your HR team describes during interviews. Listen to all employees.
3458714,11891,22512528,,,,761,San Jose,2280,CA,1,10760,Senior Systems Administrator,systems administrator,1.0,systems administrator,1.0,2013-12-26 11:41:11.437,0,2010.0,2.0,1.0,4.0,1.0,2.0,1.0,NO,Same,Disapprove,Netflix,NFLX,COMPANY_PUBLIC,4700,8830669000,Internet,Information Technology,"Pay and the Netflix name helps on your resume, since most people outside do not know how bad it is inside.","Mind numbing. Stress.  Constantly watching your back.  There are people who have very high title (Directors,  Managers, even VPs) who got it because they've managed to stay there the longest.  Not because they are qualified for the job.  The long timer/oldtimers survived by CYA each others.  Those who they think are dangerous to their job will get the knife in the back.

It's not how good you are.  It's how well you ""play the game"" and ""fit in with the political culture"".  They value ""safe"" decisions that do not rock the boat.  At least in the IT Ops dept that I worked in.","Get your head out of the cloud once in a while.  There's real problem underneath.  Engineering got tired of the dysfunctional IT Ops group, and built their own infrastructure so they don't have to deal with incompetent people.

Best thing to do is fire everyone in Ops, and start fresh."
3541616,11891,22602327,MALE,1965.0,,761,San Jose,2280,CA,1,639723,Senior Weblogic Architect,,0.0,,0.0,2014-01-15 15:33:20.913,0,2010.0,5.0,5.0,5.0,3.0,3.0,3.0,YES,Better,Approve,Netflix,NFLX,COMPANY_PUBLIC,4700,8830669000,Internet,Information Technology,Nice company to work with NetFlix. No body compete salary in the Bay Area. Good Environment. You will get nice free lunch every day.,Netflix have to improve from Management Side..,
